SubPartidas Arancelarias,Descripción del producto
732392,"articulos de uso domestico y sus partes, de fundicion esmaltada."
732393,"articulos de uso domestico y sus partes, de acero inoxidable"
732394,"articulos de uso domestico, de hierro o acero esmaltado"
732399,"los demas articulos de uso domestico, de hierro o acero excepto (esmal"
732410,fregaderos y lavaplatos de acero inoxidable
732421,"bañeras de fundicion de hierro o acero, incluso esmaltada"
732429,"las demas baneras, de hierro o de acero."
732490,lavaplatos de fierro esmaltado
732510,"piezas de fundicion en acero, no maleable"
732591,"bolas y articulos similares para molinos, moldeadas, de fundicion de h"
732599,las demas manufacturas moldeadas de fundicion de hierro o acero
732611,bolas y articulos similares para molinos
732619,fittings de acero galvanizado para cercas metalicas
732620,manufacturas de alambre de hierro o de acero
732690,las demas manufacturas de hierro o acero
740100,Matas de cobre; cobre de cementación (cobre precipitado)
740110,matas de cobre.
740120,cobre de cementacion (cobre precipitado)
740200,cobre sin refinar; anodos de cobre para refinado electrolitico
740311,"catodos y secciones de catodos, de cobre refinado"
740312,"barras para alambron (wire-bars), de cobre refinado"
740313,"tochos, de cobre refinado"
740319,"los demas cobre refinados, en bruto"
740321,"aleaciones de cobre en bruto, a base de cobre-zinc (laton)"
740322,"aleaciones de cobre, en bruto, a base de cobre-estano (bronce)."
740323,"aleaciones de cobre, a base de cobre-niquel o de cobre niquel-cinc. al"
740329,"las demas aleaciones de cobre, excepto aleaciones madres de pda. 74.05"
740400,desperdicios y desechos de cobre
740500,aleaciones madre de cobre
740610,"polvo de estructura no laminar, de cobre."
740620,"polvo de estructura laminar y particulas, de cobre."
740710,barras y perfiles de cobre refinado
740721,"laton, barras (cu-zn-pb)"
740722,barras y perfiles aleaciones a base de cobre-niquel o de cobre-niquel-
740729,las demas barras y perfiles de aleaciones de cobre
740811,alambres de cobre refinado en el que la mayor dimension de la seccion
740819,los demas alambres de cobre refinado
740821,alambre de aleaciones a base de cobre
740822,alambre a base de cobre-niquel o de cobre-niquel-cinc.
740829,los demas alambre de cobre.
740911,"cobre refinado, chapas, planchas, hojas y tiras enrolladas de espesor"
740919,"chapas y bandas de cobre refinado, de espesor superior a 0,15 mm., sin"
740921,"chapas y bandas de aleaciones a base de cobre-zinc (laton), enrolladas"
740929,"chapas y bandas de aleaciones a base de cobre-zinc (laton), sin enroll"
740931,"chapas y bandas, de aleaciones de bronce, enrolladas, espesor sup. 15m"
740939,"las demas chapas y bandas de aleaciones de bronce, espesor sup. a 15 m"
740940,"chapas y bandas de aleaciones cupro-niquel o alpaca,espesor sup. a 15m"
740990,"chapas y bandas, de las demas aleaciones de cobre, espesor superior a"
741011,"hojas y tiras delgadas, de cobre refinado, sin soporte"
741012,"hojas y tiras delgadas,de aleaciones cobre,sin soporte, de espesor inf"
741021,"hojas y tiras delgadas,cobre refinado,con soporte, espesor inferior o"
741022,"hojas y tiras delgadas, de aleaciones de cobre, con soporte,espesor in"
741110,tubos de cobre refinado
741121,tubos a base de cobre-zinc (laton)
741122,tubos de cupro-niquel o alpaca.
741129,los demas tubos de cobre refinados
741210,"accesorios de tuberia, de cobre refinado."
741220,conexiones de bronce para tuberias de cobre
741300,"cables, trenzas y articulos similares, de cobre, sin aislamiento elect"
741420,telas metalicas de cobre
741490,"las demas telas metalicas y enrejados, de alambre de cobre; chapas y b"
741510,"puntas y clavos,chinchetas,grapas apuntadas y similares, de cobre."
741521,"arandelas, de cobre."
741529,"los demas articulos sin roscar, de cobre, (incluye: pernos, tornillos,"
741531,"tornillos para madera, de cobre."
741532,"los demas tornillos, pernos y tuercas, de cobre"
741533,"Tornillos, pernos, tuercas y artículos similares, roscados, de cobre (exc. escarpias rosca"
741539,"los demas articulos roscados, de cobre"
741600,muelles de cobre.
741700,"aparatos no electricos, de los tipos domesticos, de coccion o de calef"
741811,"esponjas, estropajos, guantes y articulos similares para fregar, lustr"
741819,los demas articulos de uso domestico y sus partes
741820,"articulos de higiene o de tocador, de cobre y sus partes."
741910,"cadenas y sus partes, de cobre."
741991,"las demas manufacturas de cobre, coladas, moldeadas, estampadas o forj"
741999,las demas manufacturas de cobre.
750110,matas de niquel.
750120,sinters de oxidos de niquel y demas productos intermedios de la metalu
750210,"niquel sin alear, en bruto."
750220,"aleaciones de niquel, en bruto."
750300,"desperdicios y desechos, de niquel."
750400,"polvo y particulas, de niquel."
750511,barras y perfiles de niquel sin alear
750512,barras y perfiles de aleaciones de niquel.
750521,alambre de niquel sin alear.
750522,alambre de aleaciones de niquel.
750610,"chapas, bandas y hojas, de niquel sin alear."
750620,"chapas, bandas y hojas, de aleaciones de niquel."
750711,tubos de niquel sin alear.
750712,tubos de aleaciones de niquel.
750720,"accesorios de tuberia, de niquel"
750810,"telas metalicas, redes y rejas de alambre de niquel"
750890,las demas manufacturas de niquel
760110,"aluminio en bruto, sin alear."
760120,"aleaciones de aluminio, en bruto."
760200,"aluminio, desechos y desperdicios"
760310,"polvo de estructura no laminar, de aluminio."
760320,"polvo de estructura laminar; particulas, de aluminio"
760410,barras y perfiles de aluminio sin alear
760421,perfiles huecos de aleaciones de aluminio
760429,"barras de aleaciones de aluminio; perfiles, excepto huecos, de alumini"
760511,"alambre de aluminio sin alear,con la mayor dimension de la seccion tra"
760519,los demas alambres de aluminio sin alear.
760521,"alambre de aluminio aleado, con la mayor dimension de la seccion trans"
760529,los demas alambre de aleaciones de aluminio.
760611,"chapas y bandas de aluminio sin alear, cuadradas o rectangulares, de e"
760612,"chapas y bandas aleaciones aluminio, cuadrada o rectangular, espesor s"
760691,las demas chapas y bandas de aluminio sin alear.
760692,las demas chapas y bandas de aleaciones de aluminio.
760711,"hojas y tiras delgadas, sin soporte, simplemente laminadas, de alumini"
760719,laminado para envases de cigarrillos
760720,"hojas y tiras delgadas, con soporte"
760810,tubos de aluminio sin alear
760820,tubos de aleaciones de aluminio.
760900,"accesorios de tuberia (por ejemplo: racores, codos o manguitos), de al"
761010,"puertas, ventanas y sus marcos, bastidores y umbrales, de aluminio."
761090,"estructuras de aluminio (hangares, puentes, torres)"
761100,"depositos, cisternas, cubas y recipientes similares para cualquier mat"
761210,envases tubulares flexibles de aluminio
761290,envases monoblock de aluminio para aerosol
761300,"recipientes para gases comprimidos o licuados, de aluminio."
761410,"cables, trenzas y similar, de aluminio, sin aislar, con alma de acero,"
761490,"los demas cables, trenzas y similares, de aluminio, sin aislar uso ele"
761511,"esponjas, estropajos, guantes y art. similares para fregar de aluminio"
761519,los demas articulos de uso domestico y sus partes de aluminio
761520,"articulos de higiene o de tocador, y sus partes, de aluminio."
761610,"puntas, clavos, grapas apuntadas, tornillos, pernos y similares, de al"
761691,"telas metalicas, redes y rejas de alambre de aluminio"
761699,"las demas telas metalicas, redes y rejas de alambre de aluminio"
780110,"plomo en bruto, refinado."
780191,"plomo en bruto, con antimonio como otro elemento predominante en peso"
780199,los demas plomos en bruto
780200,"desperdicios y desechos, de plomo."
780300,"barras, perfiles y alambre, de plomo."
780411,"hojas y bandas, de plomo, de espesor inferior o igual a 0.2 mm sin inc"
780419,"las demas planchas, hojas y bandas, de plomo."
780420,polvo y particulas de plomo.
780500,"tubos y accesorios de tuberia (por ejemplo: racores, codos o manguitos"
780600,las demas manufacturas de plomo
790111,"cinc en bruto sin alear, con un contenido cinc, en peso, superior o ig"
790112,"cinc en bruto sin alear, contenido cinc, en peso, inferior al 99,99%."
790120,aleaciones de cinc en bruto.
790200,"desperdicios y desechos, de cinc."
790310,"polvo de condensacion, de cinc"
790390,"los demas polvo y particulas, de cinc."
790400,"barras, perfiles y alambre, de cinc."
790500,"chapas, hojas y bandas, de cinc"
790600,"tubos y accesorios de tuberia (por ejemplo: racores, codos o manguitos"
790700,las demas manufacturas de cinc.
800110,"estano en bruto, sin alear."
800120,"aleaciones de estano, en bruto."
800200,"desperdicios y desechos, de estano."
800300,"barras, perfiles y alambre de estaño"
800400,"chapas, hojas y bandas, de estano, de espesor superior a 0,2 milimetro"
800500,"hojas y tiras, delgadas, de estano (incluso impresas o fijadas sobre p"
800600,"tubos y accesorios de tuberia (por ejemplo: racores, codos o manguitos"
800700,las demas manufacturas de estano.
810110,polvo de volframio.
810191,"volframio en bruto, incluidas barras obtenidas por sinterizado; desper"
810192,"barras, perfiles, chapas, bandas y hojas de volframio."
810193,alambre de wolframio
810194,"Volframio tungsteno en bruto, incl. las barras simplemente obtenidas por sinterizado"
810195,"Barras, perfiles, chapas, hojas y tiras, de volframio tungsteno, n.c.o.p. (exc. barras obt"
810196,Alambre de volframio tungsteno
810197,Desperdicios y desechos de volframio tungsteno (exc. cenizas y residuos que contengan volf
810199,las demas manufacturas de volframio.
810210,polvo de molibdeno.
810291,"molibdeno en bruto, incluidas las barras obtenidas simplemente por si"
810292,"barras, excepto las obtenidas simplemente por sinterizado, perfiles, c"
810293,alambre de molibdeno.
810294,"Molibdeno en bruto, incl. las barras simplemente obtenidas por sinterizado"
810295,"Barras, perfiles, chapas, hojas y tiras, de molibdeno, n.c.o.p. (exc. barras obtenidas sim"
810296,Alambre de molibdeno
810297,Desperdicios y desechos de molibdeno (exc. cenizas y residuos que contengan molibdeno)
810299,las demas manufacturas de molibdeno.
810310,"tantalo en bruto, incluidas las barras obtenidas por sinterizado; des"
810320,"Tantalio en bruto, incl. las barras simplemente obtenidas por sinterizado; polvo de tantal"
810330,Desperdicios y desechos de tantalio (exc. cenizas y residuos que contengan tantalio)
810390,las demas manufacturas de tantalo.
810411,"magnesio en bruto con contenido magnesio, en peso, sup. o igual a 98,8"
810419,los demas magnesio en bruto.
810420,desperdicios y desechos de magnesio.
810430,"torneaduras y granulos calibrados; polvo, de magnesio."
810490,las demas manufacturas de magnesio.
810510,matas de coblato y demas productos intemedios d ela metalurgia del cob
810520,Matas de cobalto y demás productos intermedios de la metalurgia del cobalto; cobalto en br
810530,"Desperdicios y desechos, de cobalto (exc. cenizas y residuos que contengan cobalto)"
810590,las demas manufacturas de cobalto.
810600,"bismuto y manufacturas de bismuto, incluidos los desperdicios y desech"
810710,cadmio en bruto; desperdicios y desechos; polvo.
810720,Cadmio en bruto; polvo de cadmio
810730,"Desperdicios y desechos, de cadmio (exc. cenizas y residuos que contengan cadmio)"
810790,las demas manufacturas de cadmio.
810810,titanio en bruto; desperdicios y desechos; polvo.
810820,Titanio en bruto; polvo de titanio
810830,"Desperdicios y desechos, de titanio (exc. cenizas y residuos que contengan titanio)"
810890,las demas munufacturas de titanio.
810910,circonio en bruto; desperdicios y desechos; polvo.
810920,Circonio en bruto; polvo de circonio
810930,"Desperdicios y desechos, de circonio (exc. cenizas y residuos que contengan circonio)"
810990,las demas manufacturas de circonio.
811000,"antimonio y manufacturas de antimonio, incluidos los desperdicios y de"
811010,Antimonio en bruto; polvo de antimonio
811020,"Desperdicios y desechos, de antimonio (exc. cenizas y residuos que contengan antimonio)"
811090,"Manufacturas de antimonio, n.c.o.p."
811100,"manganeso y manufacturas de manganeso, incluidos los desperdicios y de"
811211,berilio en bruto; desperdicios y desechos; polvo.
811212,Berilio en bruto; polvo de berilio
811213,"Desperdicios y desechos, de berilio (exc. cenizas y residuos que contengan berilio)"
811219,manufacturas de berilio.
811220,cromo
811221,Cromo en bruto; polvo de cromo
811222,"Desperdicios y desechos, de cromo (exc. cenizas y residuos que contengan cromo, así como a"
811229,"Manufacturas de cromo, n.c.o.p."
811230,germanio
811240,vanadio
811251,"Talio, en bruto; polvo de talio"
811252,"Desechos y desperdicios, de talio (exc. cenizas y residuos que contengan talio)"
811259,"Manufacturas de talio, n.c.o.p."
811291,los demas metales en bruto; desperdicios y desechos; polvo
811292,"Hafnio celtio, niobio colombio, renio, galio e indio, en bruto; desechos, desperdicios y p"
811299,"manufacturas de (incluye: galio, hafnio (celtio), indio, niobio (colom"
811300,"cermets y manufacturas de cermets, incluidos los desperdicios y desech"
820110,layas y palas.
820120,horcas.
820130,"azadas, picos, binaderas, rastrillos y raederas,"
820140,"hachas, hocinos y herramientas similares con filo"
820150,tijeras (incluidas las de ave) para usar con una sola mano.
820160,"cizallas para setos, tijeras de podar y similares para usar con las do"
820190,"las demas herramientas manuales agricolas, horticolas o forestales."
820210,sierras de mano
820220,hojas de sierra de cinta (sin fin)
820231,hojas de sierra circulares (incluida fresas-sierra) con la parte activ
820239,"las demas hojas de sierras circulares, incluidas las partes."
820240,cadenas cortantes.
820291,hojas de sierra rectas para el trabajo de los metales
820299,las demas hojas de sierra.
820310,"limas, escofinas y herramientas similares"
820320,"alicates incluso cortantes, tenazas, pinzas y herramientas similares."
820330,cizallas para metales y herramientas similares.
820340,"cortatubos, cortapernos, sacabocados y herramientas similares."
820411,"llaves de ajuste manuales, de boca fija."
820412,"llaves de ajuste manuales, de boca ajustable"
820420,"cubos intercambiables, incluso con mango."
820510,herramientas de taladrar o de roscar.
820520,martillos y mazas
820530,"cepillos, formones, gubias y herramientas cortantes similares para el"
820540,destornilladores
820551,las demas herramientas de mano de uso domestico
820559,"las demas herramientas de mano (incluidos los diamantes de vidriero),"
820560,lamparas de soldar y similares.
820570,"tornillos de banco, prensas de carpintero y similares."
820580,"yunques; forjas portatiles; muelas de mano o de pedal, con bastidor."
820590,"conjuntos o surtidos de articulos de, por lo menos, dos de las subpart"
820600,"herramientas de dos o mas de las partidas 82.02 a 82.05, acondicionada"
820713,utiles de perforacion o sondeo con parte operante de cermet.
820719,los demas utiles de perforacion o sondeo incluidas las partes.
820720,hileras de estirado o de estrusion de metales.
820730,"utiles de embutir, de estampar o de punzonar"
820740,utiles de terrajar o de filetear.
820750,utiles de taladrar
820760,utiles de mandrinar o de brochar.
820770,utiles de fresar
820780,utiles de tornear.
820790,los demas utiles intercambiables para herramientas de mano.
820810,"cuchillas y hojas cortantes, para maquinas o aparatos mecanicos para t"
820820,"cuchillas y hojas cortantes, para maquinas o aparatos mecanicos para t"
820830,"cuchillas y hojas cortantes, para aparatos de cocina o para maquinas d"
820840,"cuchillas y hojas cortantes, para maquinas agricolas, horticolas y for"
820890,"las demas cuchillas y hojas cortantes, para maquinas o aparatos mecani"
820900,"plaquitas, varillas, puntas y objetos similares para utiles, sin monta"
821000,aparatos mecanicos accionados a mano de 10kg de peso maximo de los uti
821110,"conjuntos o surtidos, de cuchillos o navajas, con hoja cortante o dent"
821191,"cuchillos de mesa, con hoja cortante o dentada."
821192,"los demas cuchillos, con hoja cortante o dentada, excepto de mesa."
821193,"navajas, incluidas las de podar, con hoja cortante o dentada."
821194,"hojas de cuchillos y navajas, cortantes o dentadas."
821195,mangos de metal comun.
821210,navajas y maquinas de afeitar
821220,"hojas de afeitar, incluidos los esbozos en fleje"
821290,"las demas partes de navajas y maquinas de afeitar, excepto hojas."
821300,tijeras y sus hojas
821410,"cortapapeles, abrecartas, raspadores, sacapuntas y sus cuchillas"
821420,herramientas y conjuntos o surtidos de herramientas de manicura o de p
821490,los demas articulos de cuchilleria.
821510,"conjuntos o surtidos que contengan por lo menos un objeto plateado, do"
821520,los demas conjuntos o surtidos de cuchilleria
821591,"cucharas, tenedor, cucharones y similares, plateados, dorados o platin"
821599,"cucharas, tenedores, cucharones y similares, excepto plateados, dorado"
830110,"candados, de metales comunes."
830120,cerraduras del tipo de las utilizadas en los vehiculos automoviles.
830130,cerraduras del tipo de las utilizadas en los muebles.
830140,las demas cerraduras; cerrojos
830150,"cierres y monturas-cierre, con cerradura."
830160,"partes de candados, cerraduras y cerrojos."
830170,llaves presentadas aisladamente
830210,bisagras
830220,rueda trasera de acero galvanizado
830230,"las demas guarniciones, herrajes y articulos similares, para vehiculos"
830241,"guarniciones, herrajes y articulos similares, de metales comunes, para"
830242,"guarniciones, herrajes y articulos similares, de metales comunes, para"
830249,barras para cortinas de baño
830250,"alzapaños, perchas, soportes y articulos similares"
830260,cierrapuertas automaticos.
830300,"cajas de caudales, puertas y compartimientos blindados para camaras ac"
830400,"clasificadores, ficheros, cajas de clasificacion, bandejas de correspo"
830510,mecanismos para encuadernacion de hojas intercambiables o para clasifi
830520,"grapas en bandas o tiras, de metales comunes."
830590,"los demas mecanismos para encuadernacion de hojas, incl. las partes"
830610,"campanas, campanillas, gongos y articulos similares, de metales comune"
830621,"estatuillas y demas objetos de adorno, plateados, dorados o platinados"
830629,"las demas estatuillas y objetos de adorno, de metales comunes"
830630,"marcos para fotografia, grabados o similares; espejos, de metales comu"
830710,"tubos flexibles, de hierro o de acero, incluso con accesorios."
830790,"tubos flexibles de los demas metales comunes, incluso con accesorios."
830810,"corchetes, ganchos y anillos para ojetes, de metales comunes"
830820,remaches tubulares o con espiga hendida
830890,"cierres, hebillas, monturas-cierre y hebillas-cierre, de metales comun"
830910,"tapones corona, de metales comunes."
830990,tapas rasgables para envases
831000,"placas indicadoras, placas rotulo, placas de direcciones y placas simi"
831110,"electrodos recubiertos para soldadura de arco, de metales comunes."
831120,"alambre relleno para soldaduras de arco, de metales comunes."
831130,"varillas recubiertas y alambre relleno para soldar al soplete, de meta"
831190,"los demas articulos similares, incluidas las partes, de metales comune"
840110,reactores nucleares.
840120,maquinas y aparatos para la separacion isotopica y sus partes.
840130,elementos combustibles (cartuchos) sin irradiar.
840140,partes de reactores nucleares.
840211,"calderas de vapor, acuotubulares, produccion vapor superior a 45 ton p"
840212,calderas acuotubulares con una produccion vapor inferior o igual a 45
840219,"las demas calderas de vapor, incluidas las calderas mixtas"
840220,calderas denominadas de agua sobrecalentada.
840290,partes de calderas de vapor.
840310,calderas para calefaccion central
840390,partes de calderas para calefaccion central.
840410,aparatos auxiliares para las calderas de partidas 84.02 u 84.03.
840420,condensadores para maquinas de vapor.
840490,partes de aparatos auxiliares para las calderas de pdas. 84.02. u 84.0
840510,"generadores de gas pobre (gas de aire) o de gas de agua, incluso con l"
840590,"partes de generadores de gas pobre, gas de agua, acetileno y generador"
840610,turbinas para la propulsion de barcos
840681,las demas turbinas de potencia superior a 40 mw
840682,las demas turbinas de potencia inferior o igual a 40 mw
840690,partes de turbinas de vapor.
840710,"motores de embolo alternativo o rotativo, encendido chispa, para la av"
840721,"motores de explosion para la propulsion de barcos, del tipo fueraborda"
840729,"motores para propulsion de barcos, excepto del tipo fueraborda."
840731,motores embolo alternativo tipo de los utilizados para la propulsion d
840732,motor embolo alternativo del tipo de los utilizados para vehiculos de
840733,"motor embolo alternativo tipo p.vehiculo cap.87, cilindrada sup.250 in"
840734,"motores de embolo alternativo para automoviles, tractores y demas vehi"
840790,los demas motores de explosion.
840810,"motores de embolo encendido comprension, para la propulsion de barcos."
840820,motores de embolo de encendido por compresion (motores diesel o semidi
840890,los demas motores de embolo de encendido por compresion
840910,partes identificables como destinadas exclusivamente a motores para av
840991,partes identificables a los motores de embolo de encendido por chispa
840999,las demas partes identificables como destinadas a los motores de embol
841011,"turbinas y ruedas hidraulicas, de potencia inferior o igual a 1000 kw."
841012,"turbinas y ruedas hidraulicas de potencia superior a 1000 kw, pero inf"
841013,turbinas y ruedas hidraulicas potencia superior a 10000 kw.
841090,"partes, incluidos los reguladores de turbinas y ruedas hidraulicas."
841111,"turborreactores, de empuje inferior o igual a 25 kn."
841112,"turborreactores, de empuje superior a 25 kn."
841121,"turbopropulsores, de potencia inferior o igual a 1.100 kw."
841122,"turbopropulsores, de potencia superior a 1.100 kw."
841181,"las demas turbinas de gas, de potencia inferior o igual a 5.000 kw."
841182,las demas turbinas de gas de potencia superior a 5.000 kw.
841191,partes de turborreactores o de turbopropulsores.
841199,"las demas turbinas de gas, partes y piezas"
841210,"propulsores a reaccion, excepto los turborreactores."
841221,motores hidraulicos con movimiento rectilineo (embolo)
841229,los demas motores hidraulicos.
841231,motores neumaticos con movimiento rectilineo (embolo).
841239,los demas motores neumaticos.
841280,los demas motores y maquinas motrices.
841290,partes y piezas demotores y maquinas motrices
841311,bombas distribucion carburante o lubricante tipo usada gasolinera o ga
841319,las demas bombas para liquidos con dispositivo medidor
841320,"bombas manuales, excepto las de las subpartidas 8413.11 u 8413.19."
841330,"bombas de carburante, de aceite o de refrigerante para motores de ence"
841340,bombas para hormigon.
841350,las demas bombas volumetricas alternativas.
841360,bombas volumetricas rotativas
841370,las demas bombas centrifugas
841381,las demas bombas para liquidos
841382,elevadores de liquidos.
841391,"bombas centrifugas, partes y piezas para"
841392,partes de elevadores de liquidos.
841410,bombas de vacio.
841420,"bombas de aire, de mano o de pedal."
841430,compresores del tipo de los utilizados en los equipos frigorificos.
841440,"compresores de aire montados en chasis remolcable, de ruedas."
841451,ventiladores con motor de potencia inferior o igual a 125 w.
841459,los demas ventiladores
841460,campanas aspirantes mayor lado horizontal inf. o igual a 120 cm.
841480,los demas bombas y compresores de aire
841490,partes de bombas y compresores de aire; de ventiladores; de campanas a
841510,"acondicionadores de aire para empotrar o para ventanas, formado un sol"
841520,acondicionadores de aire utilizados en vehiculos automoviles
841581,los demas acondicionadores de aire con equipo de enfriamiento y valvul
841582,"los demas acondicionadores de aire, con equipo de enfriamiento"
841583,"los demas acondicionadores de aire, sin equipo de enfriamiento."
841590,partes de acondicionadores de aire.
841610,"quemadores de combustibles liquidos, para alimentacion de hogares."
841620,"los demas quemadores, incluidos los mixtos, para la alimentacion de ho"
841630,"hogares automaticos, incluidos antehogar, parillas mecanicas, sus disp"
841690,partes y piezas de quemadores para alimentacion de hogares
841710,"hornos para tostacion, fusion u otros tratamientos termicos de los min"
841720,"hornos de panaderia, de pasteleria o de galleteria. no electrico."
841780,"los demas hornos industriales o de laboratorio, que no sean electrico,"
841790,partes de hornos industriales o de laboratorio que no sean electricos.
841810,combinaciones de refrigerador y congelador-conservador con puertas ext
841821,refrigeradores de uso domestico de compresion
841822,"refrigeradores domesticos, de absorcion, electricos."
841829,los demas refrigeradores domesticos.
841830,"congeladores-conservadores horizontales del tipo arca, de capacidad in"
841840,"congeladores-conservadores verticales tipo armario, capacidad inferior"
841850,"los demas armarios, arcas, vitrinas y muebles similares para la produc"
841861,grupos frigorificos de compresion en que condensador constituido por u
841869,"los demas materiales, maquinas y aparatos para la produccion de frio"
841891,muebles proyectados para incorporarles un equipo de produccion de frio
841899,"las demas maquinas y aparatos para la produccion de frio, partes y pie"
841911,"calentadores instantaneos a gas, de uso domestico"
841919,"los demas calentadores de agua, de calentamiento instantaneo o acumula"
841920,esterilizadores medico-quirurgicos o de laboratorio.
841931,"secadores, para productos agricolas."
841932,"secadores, para la madera, pasta para papel, papel o carton"
