SubPartidas Arancelarias,Descripción del producto
010110,"Caballos y asnos, reproductores de raza pura"
010111,caballos reproductores de raza pura.
010119,los demas caballos vivos.
010120,"asnos, mulos y burdeganos, vivos."
010190,"Caballos, asnos, mulos y burdéganos, vivos (exc. reproductores de raza pura)"
010210,"bovinos reproductores de raza pura, vivos."
010290,los demas bovinos vivos.
010310,"porcinos reproductores de raza pura, vivos."
010391,"los demas porcinos de peso inferior a 50 kg., vivos."
010392,"los demas porcinos de peso superior o igual a 50 kg., vivos."
010410,ovinos vivos.
010420,caprinos vivos.
010511,pollitos del genero gallus domesticus de peso inferior o igual a 185 g
010512,pavos ( gallipavos ) de peso inferior o igual a 185 g.
010519,"los demas pollitos de peso inferior o igual 185 g., vivos"
010592,gallos y gallinas de peso inferior o igual a 2000 g.
010593,gallos gallinas de peso superior a 2000 g
010594,"Gallos, gallinas, patos, gansos, pavos (gallipavos) y pintadas, de las especies domésticas"
010599,"los demas gallos, gallinas, patos, pavos"
010600,los demas animales vivos.
010611,Primates vivos
010612,"Ballenas, delfines y marsopas mamíferos del orden Cetáceos, manatíes y dugones o dugongos"
010619,"Mamíferos vivos (exc. primates, ballenas, delfines y marsopas mamíferos del orden Cetáceos"
010620,"Reptiles, incl. las serpientes y las tortugas de mar, vivos"
010631,"Aves de rapiña, vivas"
010632,"Psitaciformes, incl. los loros, guacamayos, cacatúas y demás papagayos"
010639,"Aves vivas (exc. aves de rapiña y psitaciformes, incl. los loros, guacamayos, cacatúas y d"
010690,"Animales vivos (exc. mamíferos, reptiles, aves, pescados, crustáceos, moluscos y otros inv"
020110,"carne de bovinos en canales o medios canales, fresca o refrigerada."
020120,"carne de bovinos en trozos sin deshuesar, fresca o refrigerada."
020130,"carne de bovinos deshuesada, fresca o refrigerada."
020210,"carne de bovinos en canales o medios canales, congelada."
020220,"carne de bovinos en trozos sin deshuesar, congelada."
020230,"carne de bovinos deshuesada, congelada."
020311,"carne de porcino fresca o refrigerada, en canales o medios canales"
020312,"jamones, paletas y sus trozos, sin deshuesar, frescos o refrigerados."
020319,"las demas carnes de porcinos, frescas o refrigeradas."
020321,"carne de porcinos en canales o medios canales, congelada."
020322,"jamones, paletas y sus trozos, congelados sin deshuesar"
020329,"las demas carnes de porcino, congeladas."
020410,"canales o medios canales de cordero, frescos o refrigerados."
020421,"las demas carnes de ovinos, en canales o medios canales, frescas o ref"
020422,"los demas cortes de ovinos, sin deshuesar, frescos o refrigerados."
020423,"las demas carnes de ovinos, deshuesadas, frescas o refrigeradas."
020430,"carne de cordero congelada, en canales o medios canales"
020441,las demas carnes de ovinos congelada en canales o medios canales.
020442,"los demas cortes (trozos) de carne de ovinos congelada,sin deshuesar"
020443,"las demas carnes de la especie ovina deshuesada, congelada"
020450,"carne de animales de la especie caprina, fresca, refrigerada o congela"
020500,"carne de animales de las especies caballar, asnal o mular, fresca, ref"
020610,"despojos comestibles de animales de la especie bovina, frescos o refri"
020621,"lenguas de bovinos, congeladas."
020622,"higados de bovinos, congelados."
020629,"los demas despojos comestibles de bovinos, congelados."
020630,"despojos comestibles de porcinos, frescos o refrigerados."
020641,"higados de porcinos, congelados."
020649,"los demas despojos comestibles de la especie porcina, congelados"
020680,"los demas despojos comestibles de animales, frescos o refrigerados."
020690,los demas despojos comestibles de animales congelados.
020711,"carnes y despojos comestibles de gallo o gallina sin trocear fresco,re"
020712,carne y despojos comestibles de gallo o gallina sin trocear congelados
020713,"trozos y despojos de gallo o gallina, frescos o refrigerados"
020714,"trozos y despojos de gallo o gallina, congelados"
020724,"carne y despojos sin trocear de pavo, fresco o refrigerado"
020725,"carne y despojos de pavo sin trocear, congelados"
020726,"trozos y despojos de pavo, frescos o refrigerados"
020727,trozos y despojos de pavo congelados
020732,"carne y despojos de pato, ganso o pintada sin trocear fresco o refrige"
020733,"carne y despojos de pato, ganso o pintada sin trocear congelados"
020734,"higados grasos de pato, ganso o pintada, frescos,refrigerados"
020735,"las demas carnes y despojos de pato,ganso o pintada frescos, refrigera"
020736,"las demas carnes y despojos de pato,ganso o pintada, congelados."
020810,carne de conejo o liebre refrigerada o congelada
020820,"ancas de rana, frescas, refrigeradas o congeladas."
020830,"Carne y despojos comestibles de primates, frescos, refrigerados o congelados"
020840,"Carne y despojos comestibles de ballenas, delfines y marsopas mamíferos del orden Cetáceos"
020850,"Carne y despojos comestibles de reptiles, incl. las serpientes y las tortugas de mar, fres"
020890,"las demas carnes y despojos comestibles, frescas, refrigeradas o conge"
020900,"tocino sin partes magras y grasa sin fundir de cerdo o de ave, frescos"
021011,"jamones, paletas y sus trozos sin deshuesar, salados o en salmuera, se"
021012,"panceta y sus trozos, salados o en salmuera, secos o ahumados."
021019,"las demas carnes de porcinos saladas o en salmuera, secas o ahumadas."
021020,"carne de bovinos salada o en salmuera, seca o ahumada."
021090,"los demas, incluidos la harina y el polvo comestible, de carne o despo"
021091,"Carne y despojos comestibles, salados o en salmuera, secos o ahumados, así como harina y p"
021092,"Carne y despojos comestibles, salados o en salmuera, secos o ahumados, así como harina y p"
021093,"Carne y despojos comestibles, salados o en salmuera, secos o ahumados, así como harina y p"
021099,"Carne y despojos comestibles, salados o en salmuera, secos o ahumados, y harina y polvo co"
030110,"peces ornamentales, vivos."
030191,"truchas, vivas."
030192,anguilas vivas.
030193,carpas vivas.
030194,Peces vivos : Los demás peces vivos : Atunes comunes o de aleta azul (Thunnus thynnus)
030195,Peces vivos : Los demás peces vivos : Atunes del sur (Thunnus maccoyii)
030199,los demas peces vivos.
030211,"truchas frescas o refrigeradas, excluidos filete, higado, huevas, lech"
030212,"salmones del pacifico, atlantico y danubio, fresco o refrigerado."
030219,"los demas salmonidos, frescos o refrigerados, excluido filete, higados"
030221,"halibut fresco o refrigerads excluidos filetes, higados, huevas."
030222,"sollas frescas o refrigeradas, excluidos filete, higados, huevas y lec"
030223,"lenguados frescos o refrigerados, excluidos filetes, higado, huevas, l"
030229,"los demas pescados planos, frescos o refrigerados, excluidos: filetes,"
030231,"albacoras o atunes blancos, frescos o refrigerados excl. higados, huev"
030232,"atunes de aleta amarilla, frescos o refrigerados, excluido higados, hu"
030233,"listados o bonitos de vientre rayado frescos o refrigerados, excluido"
030234,"Patudos o atunes ojo grande Thunnus obesus, frescos o refrigerados"
030235,"Atunes comunes o de aleta azul Thunnus thynnus, frescos o refrigerados"
030236,"Atunes del sur Thunnus maccoyii, frescos o refrigerados"
030239,"los demas atunes, frescos o refrigerados, excluido los higados, huevas"
030240,"arenques frescos o refrigerados, excludos filetes, higados, huevas y l"
030250,"bacalaos frescos o refrigerados, excluidos filetes, higados, huevas y"
030261,"sardinas, sardinelas y espadines frescos o refrig. excluido filete, hi"
030262,"eglefinos frescos o refrigerados, excluidos filetes, higados, huevas y"
030263,"carboneros frescos o refrigerados, excluidos filetes, higados, huevas"
030264,"caballas frescas o refrigeradas, excluidos filetes, higados, huevas y"
030265,escualos.
030266,"anguilas(anguilla spp)frescos o refrigerados, excepto higados, huevas"
030267,Pescado fresco o refrigerado (excepto los filetes y demás carne de pescado de la partida 0
030268,Pescado fresco o refrigerado (excepto los filetes y demás carne de pescado de la partida 0
030269,"los demas pescados frescos o refrigerados, excluye filetes, higados, h"
030270,"higados, huevas y lechas fresca o refrigeradas"
030310,"salmones del pacifico congelado, excluidos filetes, higados, huevas y"
030311,"Salmones rojos Oncorhynchus nerka, congelados"
030319,"Salmones del Pacífico Oncorhynchus gorbuscha, Oncorhynchus keta, Oncorhynchus tschawytscha"
030321,"truchas congeladas, excluidos los filetes, higados, huevas y lechas."
030322,"salmones del atlantico y del danubio congelados, excluido filete, higa"
030329,"los demas salmonidos congelados, excluidos filete, higado, huevas y le"
030331,"halibut congelado, excluido filetes, higados, huevas y lechas"
030332,"sollas congeladas, excluido filetes, higados, huevas y lechas."
030333,"lenguados congelados, excluidos filetes, higados, huevas y lechas."
030339,"los demas pescados planos congelados, excluido filetes, higados, hueva"
030341,"albacoras o atunes blancos congelados excluido filete, higado, huevas"
030342,"atunes de aleta amarilla congelados, excluido filete, higado, huevas y"
030343,"listados o bonitos de vientre rayado congelados, exc. filete, higados,"
030344,"Patudos o atunes ojo grande Thunnus obesus, congelados"
030345,"Atunes comunes o de aleta azul Thunnus thynnus, congelados"
030346,"Atunes del sur Thunnus maccoyii, congelados"
030349,"los demas atunes congelados, excluido filetes, higados, huevas y lecha"
030350,"arenques congelados, excluidos filetes higados, huevas y lechas."
030351,Pescado congelado (excepto los filetes y demás carne de pescado de la partida 0304) : Aren
030352,Pescado congelado (excepto los filetes y demás carne de pescado de la partida 0304) : Aren
030360,"bacalaos congelados, excluidos filetes higados, huevas y lechas."
030361,Pescado congelado (excepto los filetes y demás carne de pescado de la partida 0304) : Pez
030362,Pescado congelado (excepto los filetes y demás carne de pescado de la partida 0304) : Pez
030371,"sardinas, sardinelas , espadines congelados, excluido filete, higados,"
030372,"eglefinos congelados, excluidos filetes, higados, huevas y lechas."
030373,"carboneros congelados, excluido filetes higados, huevas y lechas."
030374,"caballas congeladas, excluido filetes higados, huevas y lechas."
030375,"escualos congelados, excluido filete, higado, huevas y lechas"
030376,"anguilas congeladas, excluidos filetes higados, huevas y lechas"
030377,"robalos congelados, excluidos filetes higados, huevas y lechas"
030378,"merluzas congeladas, excluidos filetes, higados huevas y lechas."
030379,"los demas pescados congelados, excluidos filetes, higados, huevas y le"
030380,"higados, huevas y lechas de pescados, congelados."
030410,filetes y demas carnes de pescado frescos o refrigerados
030411,"Filetes y demás carne de pescado (incluso picada), frescos, refrigerados o congelados : Fr"
030412,"Filetes y demás carne de pescado (incluso picada), frescos, refrigerados o congelados : Fr"
030419,"Filetes y demás carne de pescado (incluso picada), frescos, refrigerados o congelados : Fr"
030420,filetes congelados.
030421,"Filetes y demás carne de pescado (incluso picada), frescos, refrigerados o congelados : Fi"
030422,"Filetes y demás carne de pescado (incluso picada), frescos, refrigerados o congelados : Fi"
030429,"Filetes y demás carne de pescado (incluso picada), frescos, refrigerados o congelados : Fi"
030490,las demas carnes de pescado congelada
030491,"Filetes y demás carne de pescado (incluso picada), frescos, refrigerados o congelados : La"
030492,"Filetes y demás carne de pescado (incluso picada), frescos, refrigerados o congelados : La"
030499,"Filetes y demás carne de pescado (incluso picada), frescos, refrigerados o congelados : La"
030510,harina de pescado apta para la alimentacion humana.
030520,"higados, huevas y lechas de pescado, secos, ahumados, salados o en sal"
030530,"filetes de pescado, secos, salados o en salmuera, sin ahumar."
030541,"salmones del pacifico, atlantico o danubio, ahumados, incluido filetes"
030542,"arenques ahumados, incluidos filetes."
030549,"los demas pescados ahumados, incluidos filetes."
030551,"bacalaos secos, incluso salado, sin ahumar."
030559,"los demas pescados secos, incluso salado, sin ahumar."
030561,arenques salado sin secar ni ahumar o en salmuera.
030562,"bacalaos salados, sin secar ni ahumar o en salmuera."
030563,anchoas saladas sin secar ni ahumar o en salmuera.
030569,los demas pescados salados sin secar ni ahumar o en salmuera.
030611,langostas congeladas.
030612,bogavantes congelados.
030613,"camarones, langostinos, quisquillas"
030614,"cangrejos de mar, congelados."
030619,los demas crustaceos congelados.
030621,"langostas, sin congelar."
030622,"bogavantes, sin congelar."
030623,"camarones, langostinos, quisquillas y gambas sin congelar."
030624,"cangrejos de mar, sin congelar."
030629,"los demas crustaceos, sin congelar."
030710,"ostras, vivas, frescas, refrigeradas, congeladas, secas, saladas o en"
030721,"veneras, volandeiras y otros, vivos, frescos o refrigerados."
030729,"veneras, volandeiras otros, congelados, secos, salados o en salmuera."
030731,"mejillones, vivos, frescos o refrigerados."
030739,"mejillones, congelados, secos, salados o en salmuera."
030741,"jibias, globitos, calamares y potas, vivos, frescos o refrigerados."
030749,"jibias, globitos, calamares y potas, congelados, secos, salados o en s"
030751,"pulpos, vivos, frescos o refrigerados."
030759,"pulpos, congelados, secos, salados o en salmuera."
030760,"caracoles, excepto los de mar, vivos, frescos, refrig., congel, secos,"
030791,"los demas moluscos e invertebrados vivos, frescos o refrigerados"
030799,"los demas moluscos e invertebrados secos, salados o en salmuera"
040110,"leche y nata, sin concentrar ni edulcorar, con un contenido materia gr"
040120,"leche y nata, sin concentrar ni edulcorar con un cont. sup.1% e inferi"
040130,"leche y nata, sin concentrar ni edulcorar con un cont. materias grasas"
040210,"leche en polvo, granulos u otras formas, materia grasa inferior o igua"
040221,"leche en polvo, sin azucarar ni edulcorar de otro modo."
040229,las demas leches
040291,las demas leches sin azucarar ni edulcorar de otro modo
040299,las demas leches y natas concentradas azucadas o edulcoradas.
040310,"yogur, incluso concentrado, azucarado aromatizado, con fruta o cacao."
040390,"suero mantequilla, leche y nata cuajadas, kefir y demas leches y natas"
040410,"lactosuero, incluso concentrado, azucarado o edulcorado de otro modo."
040490,"los demas productos de componentes naturales de la leche, incluso azuc"
040510,mantequilla
040520,pastas lacteas para untar
040590,"las demas materias grasas de la leche, pastas lacteas para untar."
040610,quesos frescos (incluido el de lactosuero) sin fermentar y requeson.
040620,"queso de cualquier tipo, rallado o en polvo."
040630,"queso fundido, excepto el rallado en polvo."
040640,queso de pasta azul.
040690,los demas quesos.
040700,"huevos de ave con cascara, frescos, conservados o cocidos."
040811,"yemas de huevo, secas."
040819,"las demas yemas de huevo, frescas, cocidas, moldeadas, congeladas o co"
040891,"huevos de ave sin cascara, secos."
040899,"los demas huevos de ave sin cascara, frescos, cocidos, moldeados, cong"
040900,miel natural de abejas
041000,productos comestibles de origen animal no expresados ni comprendidos e
050100,"cabello en bruto, incluso lavado o desgrasado; desperdicios de cabello"
050210,cerdas de jabali o de cerdo y sus desperdicios.
050290,"los demas pelos de cepilleria, desperdicios de cerdas"
050300,"crin y sus desperdicios, incluso en capas con soporte o sin el."
050400,"tripas, vejigas y estomagos de animales, excepto los de pescado, enter"
050510,plumas de las utilizadas para relleno; plumon.
050590,"las demas pieles y otros partes de aves, en bruto limpiadas, desinfect"
050610,oseina y huesos acidulados.
050690,"los demas huesos y nucleos corneos, en bruto, desgrasados, preparados;"
050710,marfil; polvo y desperdicios de marfil.
050790,"los demas marfiles, conchas , cuernos, astas, cascos, pezuñas, uñas, g"
050800,"coral y materias similares, en bruto o simplemente preparados, pero si"
050900,esponjas naturales de origen animal.
051000,"ambar gris, castoreo, algalia y almizcle; cantaridas; bilis, incluso d"
051110,semen de bovino.
051191,"los demas productos de pescados o de crustaceos, moluscos u otros inve"
051199,los demas productos de origen animal
060110,"bulbos, cebollas,tuberculos, raices tuberosas, garras y rizomas, en re"
060120,"bulbos, cebollas, etc. en vegetacion o en flor; plantas y raices achic"
060210,esquejes y estaquillas sin enraizar e injertos
060220,"arboles, arbustos, plantas jovenes y matas, de frutos comestibles, inc"
060230,"rododendros y azaleas, incluso injertados."
060240,"rosales, incluso injertados"
060290,"las demas plantas vivas (incluidas sus raices), esquejes e injertos;"
060310,"flores y capullos ,cortados para ramos o adornos, frescos"
060311,"Flores y capullos, cortados para ramos o adornos, frescos, secos, blanqueados, teñidos, im"
060312,"Flores y capullos, cortados para ramos o adornos, frescos, secos, blanqueados, teñidos, im"
060313,"Flores y capullos, cortados para ramos o adornos, frescos, secos, blanqueados, teñidos, im"
060314,"Flores y capullos, cortados para ramos o adornos, frescos, secos, blanqueados, teñidos, im"
060319,"Flores y capullos, cortados para ramos o adornos, frescos, secos, blanqueados, teñidos, im"
060390,"flores y capullos, para ramos o adornos, secos, blanqueados, teñidos,"
060410,musgos y liquenes
060491,"partes de planta, sin flores ni capullos para ramos o adornos, frescos"
060499,"los demas follajes, hojas, ramas y demas partes de plantas sin florece"
070110,"patatas (papas) frescas o refrigeradas, para siembra"
070190,las demas papas frescas o refrigeradas
070200,tomates frecos o refrigerados
070310,"cebollas y chalotes, frescos o refrigerados"
070320,ajos frescos o refrigerados
070390,"puerros y demas hortalizas aliaceas, frescos o refrigerados."
070410,"coliflores y brecoles, frescos o refrigerados."
070420,"coles de bruselas, frescos o refrigerados."
070490,"los demas coles y productos similares, frescos o refrigerados."
070511,"lechugas repolladas, frescas o refrigeradas."
070519,"lechugas, excepto repolladas, frescas o refrigeradas."
070521,endibias frescas
070529,las demas achicorias frescas
070610,zanahorias y nabos frescos o refrigerados
070690,"remolachas para ensalada, salsifies, apionabos, rabanos, frescos o ref"
070700,"pepinos y pepinillos, frescos o refrigerados."
070810,guisantes o arvejas frescas o refrigeradas
070820,"alubias, incluso desvainadas, frescas o refrigeradas."
070890,"las demas legumbres, incluso desvainadas, frescas o refrigeradas."
070910,alcachofas frescas o refrigeradas
070920,esparragos frescos o refrigerados
070930,"berenjenas, frescas o refrigeradas."
070940,"apio, excepto el apinabo, frescos o refrigerados."
070951,callampas frescas o refrigeradas
070952,"trufas, frescas o refrigeradas."
070959,"Setas y demás hongos, comestibles, frescas o refrigeradas (exc. hongos del género Agaricus"
070960,pimientos del genero capsicum o del genero pimenta
070970,"espinacas y armuelles, frescas o refrigeradas."
070990,las demas hortalizas frescas o refrigerdas
071010,"patatas (papas), incluso cocidas con agua o vapor, congeladas"
071021,"arvejas, incluso desvainadas, cocidas, congeladas"
071022,"alubias, incluso desvainadas, cocidas, congeladas."
071029,"otras legumbres desvainadas, cocidas, congeladas."
071030,"espinacas y armuelles, incluso cocidas, congeladas."
071040,maiz dulce
071080,las demas legumbres y hortalizas
071090,mezclas de hortalizas y/o legumbres
071110,"cebollas conservadas provisionalmente, pero todavia impropias para ali"
071120,"aceitunas conservadas provisionalmente, pero todavia impropias para la"
071130,"alcaparras conservadas provisionalmente, pero todavia impropias para a"
071140,"pepinos y pepinillos conservados provisionalmente, aun impropios alime"
071151,"Setas y demás hongos del género Agaricus, conservadas provisionalmente, p.ej., con gas sul"
071159,"Setas y demás hongos, conservadas provisionalmente, p.ej., con gas sulfuroso o con agua sa"
071190,las demas legumbres y hortalizas; mezclas de hortalizas y/o legumbres
071220,"cebollas, incluso en trozos o rodajas, sin otra preparacion, secas."
071230,"setas y trufas, incluso en trozos o rodajas, sin otra preparacion , se"
071231,"Hongos del género Agaricus, secos, incl. los cortados en trozos o en rodajas o los tritura"
071232,"Orejas de Judas Auricularia spp., secas, incl. las cortadas en trozos o en rodajas o las t"
071233,"Hongos gelatinosos Tremella spp., secos, incl. los cortados en trozos o en rodajas o los t"
071239,"Setas y demás hongos y trufas, secas, incl. las cortadas en trozos o en rodajas o las trit"
071290,las demas legumbres y hortalizas;mezclas de hortalizas y/o legumbres
071310,arvejas secas
071320,garbanzos secos
071331,alubias especies vigna mungo hepper
071332,"alubias adzuki, secas desvainadas,"
071333,"alubia comun, seca desvainada"
071339,"las demas alubias, secas desvainadas"
071340,lentejas secas
071350,"habas, haba caballar y menor, secas desvainadas, incluso mondadas o pa"
071390,las demas legumbres secas
071410,"raices de mandioca, frescas o secas, incluso troceadas o en pellets."
071420,"batatas, frescas o secas, incluso troceadas o en pellets."
071490,"las demas raices y tuberculos similares ricos en feculas o en inulina,"
080111,cocos secos
080119,"los demas cocos, nueces del brasil y nueces de marañon frescos , secos"
080121,"nueces de brasil, frecas o secas con cascaras."
080122,"nueces de brasil, frescas o secas sin cascaras."
080131,nueces de marañon con cascaras frescas o secas.
080132,nueces de marañon sin cascaras frescas o secas.
080211,almendras con cascara frescas o secas
080212,almendras sin cascara frescas o secas
080221,avellanas con cascara frescas o secas
080222,"avellanas sin cascara, frescas o secas, incluso mondadas."
080231,nueces de nogal con cascara frescas o secas
080232,"nueces de nogal sin cascara, frescas o secas"
080240,"castañas,frescas o secas"
080250,"pistachos, frescos o secos, incluso sin cascara o mondados."
080260,"Los demás frutos de cáscara frescos o secos, incluso sin cáscara o mondados : Nueces de ma"
080290,"los demas frutos de cascara, frescos o secos, incluso sin cascara o mo"
080300,"bananas o platanos, frescos o secos."
080410,"datiles, frescos o secos."
080420,higos frescos o secos
080430,"pinas, frescas o secas."
080440,paltas (aguacates)
080450,"guayabas, mangos y mangostanes, frescos o secos."
080510,naranjas frescas
080520,"mandarinas, clementinas, wilkings e hibridos similares, frescos o seco"
080530,"limones y lima agria, frescos o secos"
080540,"toronjas o pomelos, frescos o secos."
080550,"Limones Citrus limon, Citrus limonum y limas Citrus aurantifolia, Citrus latifolia, fresco"
080590,"los demas agrios, frescos o secos."
080610,uvas frescas
080620,pasas
080711,sandias frescas
080719,"los demas melones, sandias, papayas, frescos"
080720,papayas frescas.
080810,manzanas frescas
080820,peras y membrillos frescos.
080910,damascos frescos
080920,cerezas frescas
080930,"melocotones o duraznos, incluido los griñones y nectarines"
080940,"ciruelas y endrinos, frescos."
081010,frutillas frescas
081020,"frambuesas, zarzamoras, moras y moras-frambuesas, frescas"
081030,"grosellas , incluido el casis frescos."
081040,arandanos o murtones y demas frutos del genero vaccinium frescos
081050,kiwis frescos.
081060,"Duriones, frescos"
081090,otros frutos frescos.
081110,fresas (frutillas) congeladas
081120,"frambuesas, zarzamoras, moras y moras-frambuesas y grosellas, congelad"
081190,otras frutas congeladas
081210,cerezas provisionalmente conservadas
081220,"fresas (frutillas) conservadas provisionalmente, pero impropias para a"
081290,los demas frutos conservados provisionalmente
081310,damascos desecados o deshidratados (incluye: damascos descarozados)
081320,ciruelas desecadas o deshidratadas
081330,manzanas desecadas o deshidratadas
081340,los demas frutos secos
081350,mezclas de frutas secas o de frutos de cascara de este capitulo.
081400,"cortezas de agrios, de melones y de sandias, frescas, congeladas, pres"
090111,"cafe sin tostar, sin descafeinar."
090112,"cafe sin tostar, descafeinado."
090121,cafe tostado sin descafeinar
090122,cafe tostado descafeinado
090190,los demas cafes y sucedaneos
090210,te verde en envases contenido inferior o igual a 3 kg.
090220,te verde sin fermentar presentado de otra forma.
090230,"te negro (fermentado) y té parcialmente fermentado, en envases con un"
090240,"te negro fermentado y te parcialmente fermentado, presentados de otra"
090300,yerba mate
090411,pimienta sin triturar ni pulverizar
090412,pimienta triturada o pulverizada.
090420,"pimientos secos, triturados o pulverizados (pimenton)."
090500,vainilla.
090610,"canela y flores del canelero, sin triturar ni pulverizar."
090611,Canela y flores de canelero : Sin triturar ni pulverizar : Canela (Cinnamomum zeylanicum B
090619,Canela y flores de canelero : Sin triturar ni pulverizar : Las demás
090620,"canela y flores de canelero, triturados o pulverizados."
090700,"clavo (frutos, clavillos y pedunculos)."
090810,nuez moscada.
090820,macis.
090830,amomos y cardamomos.
090910,semillas de anis o badiana
090920,semillas de cilantro.
090930,semillas de comino
090940,semillas de alcaravea
090950,semillas de hinojo o enebro
091010,jengibre
091020,azafran
091030,curcuma
091040,tomillo; hojas de laurel
091050,curry
091091,"las demas mezclas de especias, provistas en la nota 1b del capitulo 09"
091099,las demas especias
100110,trigo duro
