SubPartidas Arancelarias,Descripción del producto
551430,Tejidos de fibras sintéticas discontinuas con un contenido de estas fibras inferior al 85 
551431,tejidos con hilados de distintos colores de fibras discontinuas de pol
551432,tejidos con hilados de distintos colores de fibras discontinuas de pol
551433,los demas tejidos con hilados de distintos colores de fibras discontin
551439,los demas tejidos con hilados de distintos colores de fibras sintetica
551441,tejidos estampados de fibras discontinuas de poliester de ligamento ta
551442,tejidos estampados de fibras discontinuas de poliester de ligamento sa
551443,los demas tejidos estampados de fibras discontinuas de poliester .
551449,los demas tejidos estampados de fibras sinteticas discontinuas.
551511,"tejidos de fibras discontinuas de poliester, mezclados exclusiva o pri"
551512,"tejidos de fibras discontinuas de poliester, mezclados exclusiva o pri"
551513,"tejidos de fibras discontinuas de poliester, mezclados exclusiva o pri"
551519,los demas tejidos de fibras discontinuas de poliester.
551521,los demas tejidos de fibras discontinuas acrilicas o modacrilicas mezc
551522,los demas tejidos de fibras discontinuas acrilicas o modacrilicas mezc
551529,"los demas tejidos de fibras discontinuas, acrilicas o modacrilicas."
551591,los demas tejidos de fibras sinteticas discontinuas mezclados exclusiv
551592,los demas tejidos de fibras sinteticas discontinuas mezclados exclusiv
551599,los demas tejidos de fibras sinteticas discontinuas.
551611,tejidos crudos o blanqueados con un contenido de fibras artificiales d
551612,tejidos teñidos con un contenido de fibras artificiales discontinuas s
551613,tejidos con hilados de distintos colores con un contenido de fibras ar
551614,tejidos estampados con un contenido de fibras artificiales discontinua
551621,tejidos crudos o blanqueados con un contenido de fibras artificiales d
551622,tejidos teñidos con un contenido de fibras artificiales discontinuas i
551623,tejidos con hilados de distintos colores con un contenido de fibras ar
551624,tejidos estampados con un contenido de fibras artificiales discontinua
551631,tejidos crudos o blanqueados con un contenido de fibras artificiales d
551632,tejidos teñidos con un contenido dee fibras artificiales discontnuas i
551633,tejidos con hilados de distintos colores con un contenido de fibras ar
551634,tejidos estampados con un contenido de fibras artificiales discontinua
551641,tejidos crudos o blanqueados con un contenido de fibras artificiales d
551642,tejidos teñidos con un contenido de fibras artificiales discontinuas i
551643,tejidos con hilados de distintos colores con un contenido de fibras ar
551644,tejidos estampados con un contenido de fibras artificiales discontinua
551691,los demas tejidos crudos o blanqueados con un contenido de fibras arti
551692,los demas tejidos teñidos con un contenido de fibras artificiales disc
551693,los demas tejidos con hilados de distintos colores con un contenido de
551694,los demas tejidos estampados con un contenido de fibras artificiales d
560110,"toallas y tampones higienicos, pañales y articulos higienicos similare"
560121,"guata ; los demas articulos de guata, de algodon."
560122,guata; los demas articulos de guata de fibras sinteticas o artificiale
560129,los demas articulos de guata
560130,"tundiznos, nudos y motas, de materias textiles."
560210,fieltro punzonado y productos obtenidos mediante costura por cadeneta.
560221,"los demas fieltros sin impregnar, recubrir, revestir, ni estratificar"
560229,"los demas fieltros sin impregnar,recubrir,revestir ni estratificar de"
560290,"los demas fieltros, incluso impregnado, recubierto, revestido o estrat"
560311,telas de filamentos sinteticos o artificiales de peso inf. o igual 25g
560312,telas sin tejer de filamentos sinteticos o artificiales de peso sup.2
560313,telas sin tejer de filamentos sinteticos o artificiales de peso sup. 7
560314,"telas sin tejer peso superior a 150g/m2, de filamento sintetico"
560391,telas sin tejer de filamentos sinteticos de peso inferior o igual 25
560392,telas sin tejer de filamentos sinteticos de peso superior a 25g/m2
560393,telas sin tejer de peso superior a 70 g/m2 pero inferiror o igual a
560394,telas sin tejer de filamentos sinteticos de peso superior a 150 g/m2
560410,"hilos y cuerdas de caucho, recubiertos de textiles."
560420,"hilados de alta tenacidad de poliester, de nailon o de otras poliamida"
560490,"los demas hilados textiles impregnados, recubiertos, revestidos o enfu"
560500,"hilados metalicos e hilados metalizados, incluso entorchados, constitu"
560600,"hilados entorchados, tiras y formas similares de las partidas 54.04 o"
560710,"cordeles, cuerdas y cordajes de yute o de otras fibras textiles del li"
560721,"cuerdas para atadoras o gavilladoras, de sisal o de otras fibras texti"
560729,"los demas cordeles, cuerdas y cordajes, de sisal o de otras fibras tex"
560730,"cordeles, cuerdas y cordajes de abaca (cañamo de manila o musa textili"
560741,cuerdas para atadoras o gavilladora de polietileno o de polipropileno.
560749,"las demas cordeles, cuerdas y cordajes de polietileno o de polipropile"
560750,"cordeles, cuerdas o cordajes, de las demas fibras sinteticas."
560790,"los demas cordeles, cuerdas o cordajes, trenzados o no,incluso impregn"
560811,"redes confeccionadas para la pesca, de materias textiles sinteticas o"
560819,las demas redes de mallas confeccionadas de materias textiles.
560890,"las demas redes de mallas anudadas, en paños o en piezas, fabricadas c"
560900,"articulos de hilados, tiras o formas similares de las partidas 54.04 o"
570110,"alfombras de nudo, de lana o de pelo fino."
570190,"alfombras de nudo, de las demas materias textiles, incluso confecciona"
570210,"alfombras llamadas kelim, soumak, karamanie y alfombras similares hech"
570220,revestimientos para el suelo de fibras de coco.
570231,"las demas alfombras y revestimientos aterciopelados,sin confeccionar d"
570232,"las demas alfombras y revestimientos aterciopelados, sin confeccionar"
570239,"las demas alfombras y revestimientos aterciopelados, sin confeccionar"
570241,"las demas alfombras y revestimientos aterciopelados, confeccionados de"
570242,"las demas alfombras y revestimientos aterciopelados, confeccionados de"
570249,"las demas alfombras y revestimientos aterciopelados, confeccionados de"
570250,"Alfombras y demás revestimientos para el suelo, de materia textil, tejidos (excepto los de"
570251,las demas alfombras y revestimientos sin aterciopelar ni confeccionar
570252,las demas alfombras y revestimientos sin aterciopelar ni confeccionar
570259,las demas alfombras y revestimientos sin aterciopelar ni confeccionar
570291,las demas alfombras y revestimientos sin aterciopelar confeccionados d
570292,las demas alfombras y revestimientos sin aterciopelar confeccionados d
570299,las demas alfombras y revestimientoss sin aterciopelar confeccionados
570310,alfombras y demas revestimientos para el suelo de lana o de pelo fino.
570320,alfombras y demas revestimientos para el suelo de nailon o de otras po
570330,alfombras y demas revestimientos para el suelo de las demas materias t
570390,alfombras y demas revestimientos para el suelo de las demas materias t
570410,"alfombras y demas revestimientos para el suelo de fieltro ,sin pelo in"
570490,"las demas alfombras y demas revestimientos para el suelo, de fieltro,"
570500,las demas alfombras y revestimientos para el suelo de materias textile
580110,"terciopelo y felpa tejidos y tejidos de chenilla, excepto los articul"
580121,"terciopelo y felpa por trama, sin cortar, de algodon."
580122,pana rayada de algodon
580123,"los demas terciopelos y felpas por trama, de algodon."
580124,"terciopelo y felpa por urdimbre, sin cortar (rizados), de algodon."
580125,"terciopelo y felpa por urdimbre, cortados,de algodon."
580126,"tejidos de chenilla, de algodon."
580131,"terciopelo y felpa por trama, sin cortar de fibras sinteticas o artifi"
580132,panas rayadas sinteticas o artificiales.
580133,"los demas terciopelos y felpas por trama, de fibras sinteticas o artif"
580134,"terciopelo y felpa por urdimbre, rizados, de fibras sinteticas o artif"
580135,"terciopelo y felpa por urdimbre, cortados, de fibras sinteticas o arti"
580136,"tejidos de chenilla, de fibras sinteticas o artificiales."
580190,"terciopelo y felpa tejidos, tejidos de chenilla, de otras materias tex"
580211,"tejidos con bucles para toallas, de algodon crudos"
580219,"los demas tejidos con bucles para toallas, de algodon, excepto crudos."
580220,"tejidos con bucles para toallas, de las demas materias textiles."
580230,tejidos con bucles para toallas superficies textiles con pelo insertad
580300,Tejidos de gasa de vuelta (excepto los productos de la partida 5806)
580310,"tejidos de gasa de vuelta, de algodon."
580390,"tejidos de gasa de vuelta, de las demas materias textiles."
580410,"tul, tul-bobinot y tejidos de mallas anudadas."
580421,"encajes fabricados a maquina, de fibras sinteticas o artificiales."
580429,"encajes fabricados a maquina, de las demas materias textiles."
580430,encajes hechos a mano.
580500,"tapiceria tejida a mano (gobelinos, flandes, aubusson, beauvais y simi"
580610,"cintas de terciopelo, de felpa, de tejido de chenilla o tejidos con bu"
580620,las demas cintas con un contenido de hilos de elastomeros o hilos de c
580631,las demas cintas de algodon.
580632,los demas cintas de fibras sinteticas o artificiales.
580639,las demas cintas de las demas materias textiles.
580640,cintas sin trama de hilados o de fibras paralelizados o aglutinados.
580710,"etiquetas, escudos y articulos similares, de materias textiles, en pie"
580790,"las demas etiquetas, escudos y similares, de materias textiles, en pie"
580810,trenzas en pieza.
580890,"los demas articulos de pasamaneria, en pieza, sin bordar; bellotas, ma"
580900,tejidos de hilos de metal y tejidos de hilados metalicos o de hilados
581010,bordados quimicos o aereos y bordados con fondo recortado.
581091,"los demas bordados, de algodon."
581092,"los demas bordados, de fibras sinteticas o artificiales."
581099,los demas bordados de las demas materias textiles.
581100,"productos textiles en pieza, constituidos por una o varias capas de ma"
590110,"tejidos recubiertos de cola o materias amilaceas, del tipo de los util"
590190,"los demas, telas para calcar o transparentes para dibujar lienzos; lie"
590210,napas tramadas para neumaticos fabricadas con hilados de alta tenacida
590220,napas tramadas para neumaticos fabricadas con hilados de alta tenacida
590290,las demas napas tramadas para neumaticos fabricadas con hilados de alt
590310,"tejidos impregnados,recubiertos,revestidos con policloruro de vinilo."
590320,"tejidos impregnados,recubiertos,revestidos o estratificados con poliur"
590390,"los demas tejidos impregnados,recubiertos, revestidos o estratificados"
590410,linoleo
590490,Revestimientos para el suelo formados por un recubrimiento o revestimiento aplicado sobre
590491,los demas revestimientos con soporte de fieltro punzonado o tela sin
590492,los demas revestimientos con otros soportes textiles .
590500,revestimientos de materias textiles para paredes.
590610,"cintas adhesivas, cauchutadas, de anchura inferior o igual a 20 cms."
590691,"los demas tejidos de punto cauchutados,excepto los de la partida 59.02"
590699,"los demas tejidos cauchutados, excepto los de la partida 59.02."
590700,"los demas tejidos impregnados, recubiertos o revestidos; lienzos pinta"
590800,"mechas de materias textiles tejidas, trenzadas o de punto, para lampar"
590900,"mangueras para bombas y tubos similares, de materias textiles, incluso"
591000,"correas transportadoras o de transmision, de materias textiles, inclus"
591110,"tejidos, fieltro y tejidos revestidos de fieltro, combinados con una"
591120,"gasas y telas para cerner,incluso confeccionadas."
591131,"tejidos y fieltros sin fin o con dispositivos de union , del tipo de l"
591132,"tejidos y fieltro sin fin o con dispositivos de union, del tipo de los"
591140,capachos y tejidos gruesos del tipo de los utilizados en las prensas d
591190,los demas productos y articulos textiles para usos tecnicos
600110,"tejidos de pelo largo, de punto"
600121,"tejidos con bucles, de algodon, de punto."
600122,"tejidos con bucles, de fibras sinteticas o artificiales, de punto."
600129,"tejidos con bucles, de punto, de las demas materias textiles."
600191,los demas tejidos de algodon
600192,los demas tejidos de fibras sinteticas o artificiales
600199,los demas tejidos de las demas materias textiles.
600210,"los demas tejidos de punto, de anchura inferior o igual a 30 cm. con u"
600220,"los demas tejidos de punto, de anchura inferior o igual a 30 cm."
600230,"los demas tejidos de punto, de anchura superior a 30 cm, con un conten"
600240,"Tejidos de punto, de anchura <= 30 cm, con un contenido de hilados de elastómeros >= 5% en"
600241,"los demas tejidos punto por urdimbre,(incluidos los obtenidos en telar"
600242,"los demas tejidos punto,por urdimbre, de algodon."
600243,los demas tejidos de punto por urdimbre de fibras sinteticas o artific
600249,"los demas tejidos de punto, por urdimbre."
600290,"Tejidos de punto, de anchura <= 30 cm, con un contenido de hilados de elastómeros y de hil"
600291,"los demas tejidos de punto, de lana o de pelo fino."
600292,"los demas tejidos de punto, de algodon"
600293,los demas tejidos de punto de fibra sintetica o artificial
600299,los demas tejidos de punto.
600310,"Tejidos de punto, de anchura <= 30 cm, de lana o pelo fino (exc. con un contenido de hilad"
600320,"Tejidos de punto, de anchura <= 30 cm, de algodón (exc. con un contenido de hilados de ela"
600330,"Tejidos de punto, de anchura <= 30 cm, de fibras sintéticas (exc. con un contenido de hila"
600340,"Tejidos de punto, de anchura <= 30 cm, de fibras artificiales (exc. con un contenido de hi"
600390,"Tejidos de punto, de anchura <= 30 cm (exc. de lana o pelo fino, de algodón, de fibras sin"
600410,"Tejidos de punto de anchura > 30 cm, con un contenido de hilados de elastómeros >= 5% en p"
600490,"Tejidos de punto de anchura > 30 cm, con un contenido de hilados de elastómeros y de hilos"
600510,"Tejidos de punto por urdimbre, incl. los obtenidos en telares de pasamanería, de anchura >"
600521,"Tejidos de punto por urdimbre, incl. los obtenidos en telares de pasamanería, de anchura >"
600522,"Tejidos de punto por urdimbre, incl. los obtenidos en telares de pasamanería, de anchura >"
600523,"Tejidos de punto por urdimbre, incl. los obtenidos en telares de pasamanería, de anchura >"
600524,"Tejidos de punto por urdimbre, incl. los obtenidos en telares de pasamanería, de anchura >"
600531,"Tejidos de punto por urdimbre, incl. los obtenidos en telares de pasamanería, de anchura >"
600532,"Tejidos de punto por urdimbre, incl. los obtenidos en telares de pasamanería, de anchura >"
600533,"Tejidos de punto por urdimbre, incl. los obtenidos en telares de pasamanería, de anchura >"
600534,"Tejidos de punto por urdimbre, incl. los obtenidos en telares de pasamanería, de anchura >"
600541,"Tejidos de punto por urdimbre, incl. los obtenidos en telares de pasamanería, de anchura >"
600542,"Tejidos de punto por urdimbre, incl. los obtenidos en telares de pasamanería, de anchura >"
600543,"Tejidos de punto por urdimbre, incl. los obtenidos en telares de pasamanería, de anchura >"
600544,"Tejidos de punto por urdimbre, incl. los obtenidos en telares de pasamanería, de anchura >"
600590,"Tejidos de punto por urdimbre, incl. los obtenidos en telares de pasamanería, de anchura >"
600610,"Tejidos de punto, de anchura > 30 cm, de lana o pelo fino (exc. tejidos de punto por urdim"
600621,"Tejidos de punto, de anchura > 30 cm, de algodón, crudos o blanqueados (exc. tejidos de pu"
600622,"Tejidos de punto, de anchura > 30 cm, de algodón, teñidos (exc. tejidos de punto por urdim"
600623,"Tejidos de punto, de anchura > 30 cm, de algodón, con hilados de distintos colores (exc. t"
600624,"Tejidos de punto, de anchura > 30 cm, de algodón, estampados (exc. tejidos de punto por ur"
600631,"Tejidos de punto, de anchura > 30 cm, de fibras sintéticas, crudos o blanqueados (exc. tej"
600632,"Tejidos de punto, de anchura > 30 cm, de fibras sintéticas, teñidos (exc. tejidos de punto"
600633,"Tejidos de punto, de anchura > 30 cm, de fibras sintéticas, con hilados de distintos color"
600634,"Tejidos de punto, de anchura > 30 cm, de fibras sintéticas, estampados (exc. tejidos de pu"
600641,"Tejidos de punto, de anchura > 30 cm, de fibras artificiales, crudos o blanqueados (exc. t"
600642,"Tejidos de punto, de anchura > 30 cm, de fibras artificiales, teñidos (exc. tejidos de pun"
600643,"Tejidos de punto, de anchura > 30 cm, de fibras artificiales, con hilados de distintos col"
600644,"Tejidos de punto, de anchura > 30 cm, de fibras artificiales, estampados (exc. tejidos de"
600690,"Tejidos de punto, de anchura > 30 cm (exc. de lana o pelo fino, de algodón, de fibras sint"
610110,"abrigos,capas y similares,de punto,para hombres o niños,.. de lana o p"
610120,"abrigos,capas y similares,de punto,para hombres o ninos,.. de algodon"
610130,"abrigos,capas y similares,de punto, para hombres o niños,.. de fibras"
610190,"abrigos,capas y similares,de punto,para hombre o ninos, ..de las demas"
610210,"abrigos,chaquetones, capas, anoraks, cazadoras y articulos similares,"
610220,"abrigos,capas y similares,de punto,para mujeres o ninas, de algodon."
610230,"abrigos,chaquetones, capas, anoraks, cazadoras y articulos similares,"
610290,"abrigos,capas y similares,de punto,para mujeres o ninas,de demas mater"
610310,"Trajes (ambos o ternos), conjuntos, chaquetas (sacos), pantalones largos, pantalones con p"
610311,"trajes o ternos, de punto, para hombres o niños, de lana o de pelo fin"
610312,"trajes o ternos, de punto, para hombres o ninos, de fibras sinteticas."
610319,"trajes o ternos, de punto, para hombres o niños, de las demas materias"
610321,"conjuntos,de punto, para hombres o niños, de lana o de pelo fino."
610322,"conjuntos, de punto, para hombres o niños, de algodon."
610323,"conjuntos, de punto, para hombres o niños, de fibras sinteticas."
610329,"conjuntos, de punto, para hombres o niños, de las demas matarias texti"
610331,"chaquetas (sacos), de punto, para hombres o niños, de lana o de pelo f"
610332,"chaquetas (sacos), de punto, para hombres o niños, de algodon."
610333,"chaquetas (sacos), de punto, para hombres o niños, de fibra sintetica."
610339,"chaquetas(sacos),de punto, para hombres o niños, de las demas materias"
610341,"pantalones, pantalones con peto y pantalones cortos:para hombres o ni"
610342,"pantalones, pantalones con peto y pantalones cortos, para hombres o ni"
610343,"pantalones, pantalones con peto y pantalones cortos, para hombres o ni"
610349,"pantalones, pantalones con peto y pantalones cortos, para hombres o ni"
610411,"trajes-sastre, de punto, para mujeres o ninas, de lana o de pelo fino."
610412,"trajes-sastre, de punto, para mujeres o ninas, de algodon."
610413,"trajes-sastre, de punto, para mujeres o ninas, de fibras sinteticas."
610419,"trajes-sastre, de punto, para mujeres o niñas, de las demas materias t"
610421,"conjuntos, de punto, para mujeres o ninas, de lana o de pelo fino."
610422,"conjuntos, de punto, para mujeres o ninas, de algodon."
610423,"conjuntos de punto de fibras sinteticas, para mujeres o niñas"
610429,"conjuntos, de punto, para mujeres o niñas de las demas materias textil"
610431,"chaquetas (sacos), de punto, para mujeres o ninas, de lana o de pelo f"
610432,"chaquetas (sacos), de punto, para mujeres o ninas, de algodon."
610433,"chaquetas (sacos), de punto de fibras sinteticas, para mujeres o niñas"
610439,"chaquetas (sacos), de punto, para mujeres o ninas, de las demas materi"
610441,"vestidos, de punto, para mujeres o ninas, de lana o de pelo fino."
610442,"vestidos de algodon, para mujeres o niñas, de algodon."
610443,"vestidos, de punto de fibras sinteticas, para mujeres o niñas"
610444,"vestidos, de punto, para mujeres o ninas, de fibras artificiales."
610449,"vestidos, de punto, para mujeres o ninas, de las demas materias textil"
610451,"faldas y faldas-pantalon, de lana o de pelo fino, para mujeres o niñas"
610452,"faldas y faldas-pantalon, de punto de algodon, para mujeres o niñas"
610453,"faldas y faldas-pantalon, de punto de fibra sintetica, para mujeres o"
610459,"faldas y faldas-pantalon, de punto de las demas materias textiles, par"
610461,"pantalones, pantalones con peto y pantalones cortos de punto de lana"
610462,"pantalones , pantalones con peto y pantalones cortos de punto de algod"
610463,"pantalones, pantalones con peto y pantalones cortos de punto de fibras"
610469,"pantalones, pantalones con peto y pantalones cortos de punto, para muj"
610510,"camisas de punto de algodon, para hombres o niños"
610520,"camisas, de punto, para hombres o niños, de fibras sinteticas o artifi"
610590,"camisas, de punto, para hombre o niños, de las demas materias textiles"
610610,"camisas, blusas, blusas camiseras y polos, de punto de algodon, para m"
610620,"camisas, blusas, blusas camiseras y polos, de punto de fibra sintetica"
610690,"camisas, blusas, blusas camiseras y polos, de punto, para mujeres o n"
610711,"calzoncillos de punto de algodon, para hombres o niños"
610712,"calzoncillos, de punto, para hombres o ninos, de fibras sinteticas o a"
610719,"calzoncillos, de punto, para hombres o ninos, de las demas materias te"
610721,"camisones y pijamas, de punto de algodon, para hombres o ninos."
610722,"camisones y pijamas, de punto de fibras sinteticas, para hombres o nin"
610729,"camisones y pijamas, de punto, para hombres o ninos, de las demas mate"
610791,"albornoces, batas y similares, de punto, para hombres o ninos, de algo"
610792,"los demas albornoces, batas y articulos similares de punto, para hombr"
610799,"los demas albornoces, batas y similares, de punto, hombre o niños, de"
610811,"combinaciones y enaguas, de punto, para mujeres o ninas, de fibras sin"
610819,"combinaciones y enaguas, de punto, para mujeres o niñas, de las demas"
610821,"bragas de punto de algodon, para mujeres o niñas"
610822,"bragas de punto de fibras sinteticas o artificiales, para mujeres o ni"
610829,"bragas, de punto, para mujeres o ninas, de las demas materias textiles"
610831,"camisones y pijamas, de punto de algodon, para mujeres o niñas"
610832,"camisones y pijamas, de punto de fibras sinteticas o artificiales, par"
610839,"camisones y pijamas, de punto, para mujeres o ninas, de las demas mate"
610891,"los demas saltos de cama, albornoces, batas y similares, de punto de a"
610892,"los demas saltos de cama, albornoces, bata y articulos similares de pu"
610899,"los demas saltos de cama, albornoces, batas y similares de punto,de l"
610910,"camisetas de punto de algodon, para mujeres o niñas"
610990,camisetas de punto de las demas materias textiles.
611010,"sueteres, jerseis, pullovers, cardigans, chalecos y articulos similare"
611011,"Suéteres jerseys, pulllovers, cardiganes, chalecos y artículos similares, de punto, de lan"
611012,"Suéteres jerseys, pulllovers, cardiganes, chalecos y artículos similares, de punto, de pel"
611019,"Suéteres jerseys, pullovers, cardiganes, chalecos y artículos similares, de punto, de pelo"
611020,"sueteres, jerseis, pullovers, cardigans, chalecos y articulos similare"
611030,"sueteres, jerseis, pullovers, cardigans, chalecos y articulos similare"
611090,"sueteres, jerseis, pullovers, cardigans, chalecos y articulos similare"
611110,"prendas y complementos de vestir, de punto, para bebes, de lana o de"
611120,"prendas y complementos de vestir, de punto de algodon, para bebes"
611130,"prendas y complementos de vestir, de punto, para bebes, de fibras sint"
611190,"prendas y complementos de vestir, de las demas materias textiles."
611211,"prendas de deporte (entrenamiento), de punto de algodon"
611212,"prendas de deportes (entrenamiento), de punto de fibras sinteticas"
611219,"prendas de deporte, de punto, de las demas materias textiles."
611220,"monos (overoles) y conjuntos de esqui, de punto"
611231,"trajes y pantalones de baño, de punto de fibras sintéticas, para hombr"
611239,"trajes y pantalon bano,para hombres o niños de las demas materias text"
611241,"trajes de baño (una o dos piezas), de punto de fibras sintéticas, para"
611249,"trajes de bano (una o dos piezas), de punto de las demas materias text"
611300,"prendas confeccionadas con tejidos de punto, de las partidas 59.03, 59"
611410,"las demas prendas de vestir, de punto, de lana o de pelo fino."
611420,"las demas prendas de vestir, de punto, de algodon."
611430,"las demas prendas de vestir, de punto, de fibras sinteticas o artifici"
611490,"las demas prendas de vestir, de punto, de las demas materias textiles."
611510,"Calzas, panty-medias, leotardos, medias, calcetines y demás artículos de calcetería, inclu"
611511,"calzas (panty-medias), de punto de fibras sinteticas, con titulo de hi"
611512,"calzas (panty-medias), de punto de fibras sinteticas, con titulo de hi"
611519,"calzas (panty-medias), de punto de las demas materias textiles."
611520,medias de punto de mujer con titulo de hilado a un cabo inferior a 67
611521,"Calzas, panty-medias, leotardos, medias, calcetines y demás artículos de calcetería, inclu"
611522,"Calzas, panty-medias, leotardos, medias, calcetines y demás artículos de calcetería, inclu"
611529,"Calzas, panty-medias, leotardos, medias, calcetines y demás artículos de calcetería, inclu"
611530,"Calzas, panty-medias, leotardos, medias, calcetines y demás artículos de calcetería, inclu"
611591,los demas calcetines de lana o de pelo fino.
611592,los demas calcetines de punto de algodon.
611593,los demas calcetines de fibras sinteticas.
611594,"Calzas, panty-medias, leotardos, medias, calcetines y demás artículos de calcetería, inclu"
